<?xml version="1.0" encoding="UTF-8"?>
<supportTicket xmlns:xsi="http://www.w3.org/2001/XMLSchema-instance"
xsi:noNamespaceSchemaLocation="./supportTicket.xsd">
  <ticketNumber>
    <id>0001</id>
    <subject>Computer Problems</subject>
    <startdate>2021-02-23T04:20:00</startdate>
    <enddate>2021-02-23T04:25:03</enddate>
    <partsRequired>false</partsRequired>
    <resolved>true</resolved>
    <message userId="0002" dateSent="2021-02-23T04:20:00">Hello</message>
  </ticketNumber>
  <ticketNumber>
    <id>0002</id>
    <subject>Broken Printer</subject>
    <startdate>2021-01-02T08:30:00</startdate>
    <enddate>2021-01-02T23:59:59</enddate>
    <partsRequired>true</partsRequired>
    <resolved>false</resolved>
    <message userId="0001" dateSent="2021-01-02T09:22:00">I slopped PBandJ on the printer</message>
    <message userId="0007" dateSent="2021-01-02T12:33:00">We're going to have to get a new printer</message>
  </ticketNumber>
  <ticketNumber>
    <id>0003</id>
    <subject>Corrupt Disk Drive</subject>
    <startdate>2021-02-02T16:30:48</startdate>
    <enddate>2021-02-22T12:20:20</enddate>
    <partsRequired>true</partsRequired>
    <resolved>true</resolved>
    <message userId="0020" dateSent="2021-02-22T12:20:00">Hi Jessica, your computer is now working.</message>
  </ticketNumber>
</supportTicket>